{"$schema":"https://json-schema.org/draft/2020-12/schema","$id":"urn:harness:avo-episode.v1","type":"object","additionalProperties":false,"required":["schema","episode_id","task_family","champion_bundle_id","champion_bundle_receipt","knowledge_snapshot_digest","hard_gate_policy_digest","initial_score_milli","variation_budget","stagnation_limit","variations","sha256"],"properties":{"schema":{"const":"harness.avo-episode.v1"},"episode_id":{"$ref":"#/$defs/id"},"task_family":{"enum":["development_eval","shadow_replay","canary_traffic"]},"champion_bundle_id":{"$ref":"#/$defs/id"},"champion_bundle_receipt":{"$ref":"#/$defs/champion_receipt"},"knowledge_snapshot_digest":{"$ref":"#/$defs/digest"},"hard_gate_policy_digest":{"$ref":"#/$defs/digest"},"initial_score_milli":{"type":"integer","minimum":0},"variation_budget":{"type":"integer","minimum":1,"maximum":64},"stagnation_limit":{"type":"integer","minimum":1,"maximum":64},"variations":{"type":"array","maxItems":64,"items":{"$ref":"#/$defs/variation"}},"sha256":{"$ref":"#/$defs/digest"}},"$defs":{"id":{"type":"string","pattern":"^[A-Za-z0-9_.:-]{1,128}$"},"digest":{"type":"string","pattern":"^[0-9a-f]{64}$"},"candidate_receipt":{"type":"object","additionalProperties":false,"required":["kind","id","digest"],"properties":{"kind":{"const":"candidate"},"id":{"$ref":"#/$defs/id"},"digest":{"$ref":"#/$defs/digest"}}},"champion_receipt":{"type":"object","additionalProperties":false,"required":["kind","id","digest"],"properties":{"kind":{"const":"champion_bundle"},"id":{"$ref":"#/$defs/id"},"digest":{"$ref":"#/$defs/digest"}}},"hard_gate_receipt":{"type":"object","additionalProperties":false,"required":["kind","id","digest"],"properties":{"kind":{"const":"hard_gate"},"id":{"$ref":"#/$defs/id"},"digest":{"$ref":"#/$defs/digest"}}},"variation":{"type":"object","additionalProperties":false,"required":["sequence","variation_id","parent_candidate_id","strategy","parent_score_milli","candidate_id","candidate_receipt","correctness","correctness_evidence","candidate_score_milli","outcome"],"properties":{"sequence":{"type":"integer","minimum":1,"maximum":64},"variation_id":{"$ref":"#/$defs/id"},"parent_candidate_id":{"anyOf":[{"$ref":"#/$defs/id"},{"type":"null"}]},"strategy":{"enum":["refine","repair","reframe","retrieval"]},"parent_score_milli":{"type":"integer","minimum":0},"candidate_id":{"$ref":"#/$defs/id"},"candidate_receipt":{"$ref":"#/$defs/candidate_receipt"},"correctness":{"enum":["passed","failed","inconclusive","infrastructure_unavailable"]},"correctness_evidence":{"$ref":"#/$defs/hard_gate_receipt"},"candidate_score_milli":{"anyOf":[{"type":"integer","minimum":0},{"type":"null"}]},"outcome":{"enum":["improved","not_improved","rejected","inconclusive"]}}}}}
