{"schema":"harness.avo-episode.v1","episode_id":"episode-1","task_family":"development_eval","champion_bundle_id":"champion-1","champion_bundle_receipt":{"kind":"champion_bundle","id":"champion-1","digest":"aaaaaaaaaaaaaaaaaaaaaaaaaaaaaaaaaaaaaaaaaaaaaaaaaaaaaaaaaaaaaaaa"},"knowledge_snapshot_digest":"aaaaaaaaaaaaaaaaaaaaaaaaaaaaaaaaaaaaaaaaaaaaaaaaaaaaaaaaaaaaaaaa","hard_gate_policy_digest":"aaaaaaaaaaaaaaaaaaaaaaaaaaaaaaaaaaaaaaaaaaaaaaaaaaaaaaaaaaaaaaaa","initial_score_milli":100,"variation_budget":3,"stagnation_limit":2,"variations":[{"sequence":1,"variation_id":"variation-1","parent_candidate_id":null,"strategy":"refine","parent_score_milli":100,"candidate_id":"candidate-1","candidate_receipt":{"kind":"candidate","id":"candidate-1","digest":"aaaaaaaaaaaaaaaaaaaaaaaaaaaaaaaaaaaaaaaaaaaaaaaaaaaaaaaaaaaaaaaa"},"correctness":"passed","correctness_evidence":{"kind":"hard_gate","id":"gate-1","digest":"aaaaaaaaaaaaaaaaaaaaaaaaaaaaaaaaaaaaaaaaaaaaaaaaaaaaaaaaaaaaaaaa"},"candidate_score_milli":120,"outcome":"improved"},{"sequence":2,"variation_id":"variation-2","parent_candidate_id":"candidate-1","strategy":"retrieval","parent_score_milli":120,"candidate_id":"candidate-2","candidate_receipt":{"kind":"candidate","id":"candidate-2","digest":"aaaaaaaaaaaaaaaaaaaaaaaaaaaaaaaaaaaaaaaaaaaaaaaaaaaaaaaaaaaaaaaa"},"correctness":"passed","correctness_evidence":{"kind":"hard_gate","id":"gate-2","digest":"aaaaaaaaaaaaaaaaaaaaaaaaaaaaaaaaaaaaaaaaaaaaaaaaaaaaaaaaaaaaaaaa"},"candidate_score_milli":119,"outcome":"not_improved"}],"sha256":"4f7664e366aa84e756fafec24968e78ce587a4c13427ef4b2e0d349f5a57d580"}
